{
  "$schema": "https://json-schema.org/draft/2020-12/schema",
  "$id": "references/schema-profile/schema-profile.schema.json",
  "title": "MANAGE_JSON_SCHEMAS_PROFILE",
  "type": "object",
  "required": [
    "$id",
    "$schema",
    "title",
    "type"
  ],
  "properties": {
    "$schema": {
      "type": "string",
      "enum": [
        "https://json-schema.org/draft/2020-12/schema",
        "../../schema-profile/schema-profile.schema.json"
      ]
    },
    "$id": {
      "type": "string",
      "minLength": 1
    },
    "title": {
      "type": "string",
      "minLength": 1
    },
    "description": {
      "type": "string",
      "minLength": 1
    },
    "type": {
      "type": "string",
      "enum": [
        "array",
        "boolean",
        "integer",
        "null",
        "number",
        "object",
        "string"
      ]
    },
    "properties": {
      "type": "object",
      "additionalProperties": {
        "$ref": "#/$defs/schemaNode"
      }
    },
    "required": {
      "type": "array",
      "items": {
        "type": "string",
        "minLength": 1
      },
      "uniqueItems": true
    },
    "additionalProperties": {
      "type": "boolean"
    },
    "additionalItems": {
      "type": "boolean"
    },
    "items": {
      "$ref": "#/$defs/schemaNode"
    },
    "enum": {
      "type": "array",
      "minItems": 1
    },
    "oneOf": {
      "$ref": "#/$defs/schemaNodeArray"
    },
    "anyOf": {
      "$ref": "#/$defs/schemaNodeArray"
    },
    "allOf": {
      "$ref": "#/$defs/schemaNodeArray"
    },
    "discriminator": {
      "$ref": "#/$defs/typeDiscriminator"
    },
    "$ref": {
      "type": "string",
      "minLength": 1
    },
    "$defs": {
      "type": "object",
      "additionalProperties": {
        "$ref": "#/$defs/schemaNode"
      }
    },
    "definitions": {
      "type": "object",
      "additionalProperties": {
        "$ref": "#/$defs/schemaNode"
      }
    },
    "examples": {
      "type": "array"
    },
    "format": {
      "type": "string",
      "minLength": 1
    },
    "pattern": {
      "type": "string",
      "minLength": 1
    },
    "minimum": {
      "type": "number"
    },
    "maximum": {
      "type": "number"
    },
    "minLength": {
      "type": "integer",
      "minimum": 0
    },
    "maxLength": {
      "type": "integer",
      "minimum": 0
    },
    "minItems": {
      "type": "integer",
      "minimum": 0
    },
    "maxItems": {
      "type": "integer",
      "minimum": 0
    },
    "uniqueItems": {
      "type": "boolean"
    }
  },
  "additionalProperties": false,
  "allOf": [
    {
      "$ref": "#/$defs/discriminatedObjectNode"
    },
    {
      "$ref": "#/$defs/discriminatedUnionNode"
    }
  ],
  "$defs": {
    "schemaNode": {
      "type": "object",
      "properties": {
        "$schema": {
          "type": "string"
        },
        "$id": {
          "type": "string"
        },
        "title": {
          "type": "string"
        },
        "description": {
          "type": "string"
        },
        "type": {
          "type": "string"
        },
        "properties": {
          "type": "object",
          "additionalProperties": {
            "$ref": "#/$defs/schemaNode"
          }
        },
        "required": {
          "type": "array",
          "items": {
            "type": "string"
          },
          "uniqueItems": true
        },
        "additionalProperties": {
          "type": "boolean"
        },
        "additionalItems": {
          "type": "boolean"
        },
        "items": {
          "$ref": "#/$defs/schemaNode"
        },
        "enum": {
          "type": "array",
          "minItems": 1
        },
        "oneOf": {
          "$ref": "#/$defs/schemaNodeArray"
        },
        "anyOf": {
          "$ref": "#/$defs/schemaNodeArray"
        },
        "allOf": {
          "$ref": "#/$defs/schemaNodeArray"
        },
        "discriminator": {
          "$ref": "#/$defs/typeDiscriminator"
        },
        "$ref": {
          "type": "string"
        },
        "$defs": {
          "type": "object",
          "additionalProperties": {
            "$ref": "#/$defs/schemaNode"
          }
        },
        "definitions": {
          "type": "object",
          "additionalProperties": {
            "$ref": "#/$defs/schemaNode"
          }
        },
        "examples": {
          "type": "array"
        },
        "format": {
          "type": "string"
        },
        "pattern": {
          "type": "string"
        },
        "minimum": {
          "type": "number"
        },
        "maximum": {
          "type": "number"
        },
        "minLength": {
          "type": "integer"
        },
        "maxLength": {
          "type": "integer"
        },
        "minItems": {
          "type": "integer"
        },
        "maxItems": {
          "type": "integer"
        },
        "uniqueItems": {
          "type": "boolean"
        }
      },
      "additionalProperties": false,
      "allOf": [
        {
          "$ref": "#/$defs/discriminatedObjectNode"
        },
        {
          "$ref": "#/$defs/discriminatedUnionNode"
        }
      ]
    },
    "schemaNodeArray": {
      "type": "array",
      "minItems": 1,
      "items": {
        "$ref": "#/$defs/schemaNode"
      }
    },
    "typeDiscriminator": {
      "type": "object",
      "required": [
        "propertyName"
      ],
      "properties": {
        "propertyName": {
          "type": "string",
          "enum": [
            "type"
          ]
        }
      },
      "additionalProperties": false
    },
    "typeDiscriminatorProperty": {
      "type": "object",
      "required": [
        "enum",
        "type"
      ],
      "properties": {
        "type": {
          "type": "string",
          "enum": [
            "string"
          ]
        },
        "enum": {
          "type": "array",
          "minItems": 1,
          "items": {
            "type": "string",
            "pattern": "^[A-Z][A-Z0-9_]*$"
          }
        }
      }
    },
    "discriminatedObjectNode": {
      "if": {
        "properties": {
          "type": {
            "enum": [
              "object"
            ]
          }
        },
        "required": [
          "type"
        ]
      },
      "then": {
        "required": [
          "additionalProperties",
          "properties",
          "required"
        ],
        "properties": {
          "additionalProperties": {
            "enum": [
              false
            ]
          },
          "properties": {
            "required": [
              "type"
            ],
            "properties": {
              "type": {
                "$ref": "#/$defs/typeDiscriminatorProperty"
              }
            }
          },
          "required": {
            "contains": {
              "enum": [
                "type"
              ]
            }
          }
        }
      }
    },
    "discriminatedUnionNode": {
      "if": {
        "anyOf": [
          {
            "required": [
              "oneOf"
            ]
          },
          {
            "required": [
              "anyOf"
            ]
          }
        ]
      },
      "then": {
        "required": [
          "discriminator"
        ],
        "properties": {
          "discriminator": {
            "$ref": "#/$defs/typeDiscriminator"
          }
        }
      }
    }
  }
}
